{
  "version": 1,
  "generatedAt": "2026-09-23",
  "report": "docs/compression-eval-report.md",
  "cards": [
    {
      "id": "export_onnx",
      "label": {
        "zh": "导出 ONNX",
        "en": "Export ONNX"
      },
      "summary": {
        "zh": "PyTorch 检查点转 ONNX（torch.onnx.export + onnxsim 简化），后续量化/推理的前置步骤。",
        "en": "Convert a PyTorch checkpoint to ONNX (torch.onnx.export + onnxsim), the prerequisite for quantization and ONNX runtimes."
      },
      "group": "格式转换",
      "calibration": {
        "needed": false,
        "note": {
          "zh": "不需要数据；只需输入形状/opset。",
          "en": "No data needed; only input shape / opset."
        }
      },
      "inputs": [
        {
          "name": "--base-model-path",
          "required": true,
          "format": {
            "zh": ".pt/.pth 检查点",
            "en": ".pt/.pth checkpoint"
          },
          "note": {
            "zh": "state_dict / torch.save(model) / build_model(config) 三种格式都支持",
            "en": "state_dict, torch.save(model) and build_model(config) are all supported"
          }
        },
        {
          "name": "--arch-file",
          "required": false,
          "format": {
            "zh": "模型定义 .py（含 build_model）",
            "en": "model definition .py (with build_model)"
          },
          "note": {
            "zh": "检查点只有权重时必须提供；同目录有 arch.py 时自动使用",
            "en": "Required when the checkpoint only holds weights; an arch.py next to the model is picked up automatically"
          }
        },
        {
          "name": "--input-shape",
          "required": true,
          "format": {
            "zh": "如 1x3x32x32（表格模型 1x7）",
            "en": "e.g. 1x3x32x32 (tabular: 1x7)"
          }
        }
      ],
      "suits": {
        "models": [
          "cnn",
          "transformer",
          "tabular",
          "yolo"
        ],
        "tasks": [
          "image-classification",
          "object-detection",
          "tabular-classification"
        ]
      },
      "effect": {
        "compression": {
          "zh": "体积≈持平（FP32 精度不变，实测 +3%）",
          "en": "Same size (FP32 kept, measured +3%)"
        },
        "accuracy": {
          "zh": "精度不变（数值等价）",
          "en": "Unchanged (numerically equivalent)"
        },
        "latency": {
          "zh": "ONNX Runtime 通常略快于 PyTorch eager",
          "en": "ONNX Runtime is usually slightly faster than PyTorch eager"
        }
      },
      "limits": [
        {
          "zh": "必须给输入形状；表格/非图像模型要显式指定（如 1x7）。",
          "en": "Input shape is mandatory; non-image models must pass it explicitly (e.g. 1x7)."
        },
        {
          "zh": "默认静态 batch（1）；需要动态 batch 要加 --dynamic-axes，且动态 batch 与 INT8 动态量化组合受限。",
          "en": "Static batch=1 by default; use --dynamic-axes for dynamic batch, which then conflicts with dynamic INT8 quantization."
        },
        {
          "zh": "YOLO 走 ultralytics 分支，需要 ultralytics 依赖与 imgsz。",
          "en": "YOLO uses the ultralytics branch (needs the dependency and --imgsz)."
        }
      ],
      "evidence": {
        "dataset": "CIFAR10-test (10,000 samples)",
        "summary": {
          "zh": "压缩率 3.0%；体积 392,548 → 380,919 B；Top-1 68.79% → 68.79%（+0.00pp）；p50 0.098 ms / p99 0.339 ms；作业耗时 3.133 s",
          "en": "3.0% smaller; 392,548 → 380,919 B; Top-1 68.79% → 68.79% (+0.00pp); p50 0.098 ms / p99 0.339 ms; job took 3.133 s"
        },
        "baseline_accuracy": 0.6879,
        "result_accuracy": 0.6879,
        "bytes_before": 392548,
        "bytes_after": 380919,
        "duration_s": 3.133,
        "report_anchor": "docs/compression-eval-report.md#01-export"
      }
    },
    {
      "id": "export_gguf",
      "label": {
        "zh": "GGUF 导出",
        "en": "Export GGUF"
      },
      "summary": {
        "zh": "把 HuggingFace 因果语言模型转成 llama.cpp 的 GGUF（f16/q8_0/q4_K_M…），供 ollama/llama.cpp 生态直接加载。",
        "en": "Convert a HuggingFace causal LM to llama.cpp GGUF (f16/q8_0/q4_K_M…) for ollama / llama.cpp."
      },
      "group": "格式转换",
      "calibration": {
        "needed": false,
        "note": {
          "zh": "不需要数据。",
          "en": "No data needed."
        }
      },
      "inputs": [
        {
          "name": "--base-model-path",
          "required": true,
          "format": {
            "zh": "HF 模型目录（config.json 所在目录）",
            "en": "HF model directory (with config.json)"
          }
        },
        {
          "name": "--outtype",
          "required": false,
          "format": {
            "zh": "f16 | q8_0 | q4_0 | q4_K_M | q6_K …",
            "en": "f16 | q8_0 | q4_0 | q4_K_M | q6_K …"
          },
          "note": {
            "zh": "默认 f16",
            "en": "f16 by default"
          }
        },
        {
          "name": "llama.cpp 工具",
          "required": true,
          "format": {
            "zh": "离线目录或可访问网络",
            "en": "offline directory OR network access"
          },
          "note": {
            "zh": "用 --llama-cpp-path 指到含 convert_hf_to_gguf.py 的目录；否则引擎会联网拉取",
            "en": "Point --llama-cpp-path at a directory containing convert_hf_to_gguf.py; otherwise the engine fetches it online"
          }
        }
      ],
      "suits": {
        "models": [
          "llm"
        ],
        "tasks": [
          "text-generation"
        ]
      },
      "effect": {
        "compression": {
          "zh": "按 outtype：f16≈2×缩小，q4_K_M 约 4~5×缩小",
          "en": "Depends on outtype: f16 ≈ 2×, q4_K_M ≈ 4–5× smaller"
        },
        "accuracy": {
          "zh": "q4_K_M 通常 <1% 困惑度上升；f16 无损失",
          "en": "q4_K_M usually <1% PPL increase; f16 lossless"
        },
        "latency": {
          "zh": "llama.cpp CPU 推理，量化越低位越快",
          "en": "llama.cpp CPU inference; lower bits run faster"
        }
      },
      "limits": [
        {
          "zh": "需要 llama.cpp 的 convert_hf_to_gguf.py；离线环境要把工具放进 deploy/compress/llama-cpp/（或 --llama-cpp-path 指向本机 checkout）。",
          "en": "Requires llama.cpp's convert_hf_to_gguf.py; offline hosts must place it in deploy/compress/llama-cpp/ (or point --llama-cpp-path at a local checkout)."
        },
        {
          "zh": "自定义架构（非 llama/qwen/gpt 系）可能不被工具支持。",
          "en": "Custom architectures outside the llama/qwen/gpt families may be unsupported."
        },
        {
          "zh": "实测：Qwen2.5-0.5B → q4_K_M 511 MB（−48.8%）、31 s、离线可复现；困惑度损失未单独测（PPL 见 INT4 行）。",
          "en": "Measured: Qwen2.5-0.5B → q4_K_M 511 MB (−48.8%) in 31 s, fully offline; perplexity loss not measured separately (see the INT4 row for PPL)."
        }
      ],
      "evidence": {
        "dataset": "Qwen2.5-0.5B（服务器本地 HF 目录）",
        "summary": {
          "zh": "q4_K_M 511 MB（HF 基线 1000 MB，−48.8%）；使用本机离线 llama.cpp 工具完成（无需联网）；outtype=q4_K_M；耗时 31 s",
          "en": "q4_K_M 511 MB (HF baseline 1000 MB, −48.8%); converted with the on-host llama.cpp toolchain (no network); outtype=q4_K_M; took 31 s"
        },
        "baseline_accuracy": null,
        "result_accuracy": null,
        "bytes_before": 999602900,
        "bytes_after": 511434656,
        "duration_s": 31.368,
        "report_anchor": "docs/compression-eval-report.md#410-export_gguf22-qwen-gguf"
      }
    },
    {
      "id": "quantize_onnx",
      "label": {
        "zh": "ONNX 动态 INT8",
        "en": "ONNX dynamic INT8"
      },
      "summary": {
        "zh": "onnxruntime 权重动态量化（激活运行时定标）：免校准数据、一条命令把 FP32 ONNX 压到约 1/4。",
        "en": "onnxruntime weight-only dynamic quantization: no calibration data, roughly 4× smaller than the FP32 ONNX."
      },
      "group": "量化",
      "calibration": {
        "needed": false,
        "note": {
          "zh": "不需要校准数据。",
          "en": "No calibration data."
        }
      },
      "inputs": [
        {
          "name": "--base-model-path",
          "required": true,
          "format": {
            "zh": "ONNX（.onnx）",
            "en": "ONNX (.onnx)"
          }
        },
        {
          "name": "--external-data-path",
          "required": false,
          "format": {
            "zh": "外部权重 .onnx.data（文件或目录）",
            "en": "external weights .onnx.data (file or directory)"
          },
          "note": {
            "zh": "仅当 ONNX 带 external data 时必填；引擎会把权重内联成单文件",
            "en": "Only required for ONNX with external data; the engine inlines it into a single file"
          }
        }
      ],
      "suits": {
        "models": [
          "cnn",
          "transformer",
          "tabular",
          "llm"
        ],
        "tasks": [
          "image-classification",
          "tabular-classification",
          "text-generation"
        ]
      },
      "effect": {
        "compression": {
          "zh": "约 3.5~4.5× 缩小（实测 −73.7%）",
          "en": "≈3.5–4.5× smaller (measured −73.7%)"
        },
        "accuracy": {
          "zh": "实测 Top-1 68.79% → 68.27%（−0.52pp）",
          "en": "Measured Top-1 68.79% → 68.27% (−0.52pp)"
        },
        "latency": {
          "zh": "p50 0.44 ms / p99 0.79 ms（batch=1）",
          "en": "p50 0.44 ms / p99 0.79 ms (batch=1)"
        }
      },
      "limits": [
        {
          "zh": "只量化权重，激活仍 FP32：提速有限（本 demo 反而比静态 INT8 慢 5×）。",
          "en": "Weights only, activations stay FP32: limited speed-up (here 5× slower than static INT8)."
        },
        {
          "zh": "动态 batch 注意力图与动态量化组合会触发 onnxruntime 形状限制。",
          "en": "Dynamic-batch attention graphs conflict with ORT quantizer shape checks."
        },
        {
          "zh": "旧导出器写的形状标注自相矛盾时，引擎自动剔除 value_info 重试（看 metrics.shape_repair）。",
          "en": "When legacy exporters write contradictory shape annotations the engine strips value_info and retries (see metrics.shape_repair)."
        }
      ],
      "evidence": {
        "dataset": "CIFAR10-test (10,000 samples)",
        "summary": {
          "zh": "压缩率 73.7%；体积 392,548 → 103,310 B；Top-1 68.79% → 68.27%（-0.52pp）；p50 0.44 ms / p99 0.787 ms；作业耗时 20.815 s",